{
  "$schema": "https://json-schema.org/draft/2020-12/schema",
  "$id": "https://scheduleoptimization.local/backend/config.schema.json",
  "title": "Schedule Optimization Config",
  "type": "object",
  "additionalProperties": false,
  "required": [
    "agents",
    "vacations",
    "vacation_durations",
    "holidays"
  ],
  "properties": {
    "agents": {
      "type": "array",
      "minItems": 1,
      "items": {
        "$ref": "#/$defs/agent"
      }
    },
    "vacations": {
      "type": "array",
      "minItems": 1,
      "uniqueItems": true,
      "items": {
        "$ref": "#/$defs/shift"
      }
    },
    "vacation_durations": {
      "type": "object",
      "additionalProperties": {
        "type": "number",
        "exclusiveMinimum": 0
      },
      "required": [
        "Conge"
      ],
      "properties": {
        "Conge": {
          "type": "number",
          "exclusiveMinimum": 0
        }
      }
    },
    "training_duration_hours": {
      "type": "number",
      "exclusiveMinimum": 0
    },
    "staffing_requirements": {
      "type": "object",
      "additionalProperties": {
        "type": "integer",
        "minimum": 0
      }
    },
    "holidays": {
      "type": "array",
      "uniqueItems": true,
      "items": {
        "type": "string",
        "pattern": "^(0[1-9]|[12][0-9]|3[01])-(0[1-9]|1[0-2])$"
      }
    },
    "external_assignment_types_durations": {
      "type": "object",
      "additionalProperties": {
        "type": "number",
        "exclusiveMinimum": 0
      }
    },
    "restriction_types_durations": {
      "deprecated": true,
      "type": "object",
      "additionalProperties": {
        "type": "number",
        "exclusiveMinimum": 0
      }
    },
    "solver": {
      "type": "object",
      "additionalProperties": false,
      "properties": {
        "max_time_seconds": {
          "type": "integer",
          "minimum": 1
        },
        "relative_gap_limit": {
          "type": "number",
          "exclusiveMinimum": 0,
          "maximum": 1
        },
        "num_search_workers": {
          "type": "integer",
          "minimum": 0
        },
        "global_max_gap": {
          "type": "integer",
          "minimum": 0
        },
        "period_max_gap": {
          "type": "integer",
          "minimum": 0
        },
        "max_weekly_hours": {
          "type": "number",
          "exclusiveMinimum": 0
        },
        "preferred_max_hours_per_rolling_5_days": {
          "type": "number",
          "exclusiveMinimum": 0
        },
        "optimize_period_balance": {
          "type": "boolean"
        },
        "period_balance_weight": {
          "type": "integer",
          "minimum": 0
        },
        "min_free_weekends_per_horizon": {
          "type": "integer",
          "minimum": 0
        },
        "weekend_monday_night_penalty": {
          "type": "integer",
          "minimum": 0
        },
        "coworker_preference_weight": {
          "type": "integer",
          "minimum": 0
        }
      }
    },
    "half_vacations": {
      "type": "object",
      "additionalProperties": {
        "$ref": "#/$defs/half_vacation"
      }
    },
    "vacation_colors": {
      "type": "object",
      "additionalProperties": {
        "type": "string",
        "pattern": "^#[0-9A-Fa-f]{6}$"
      }
    },
    "vacation_metadata": {
      "type": "object",
      "additionalProperties": {
        "$ref": "#/$defs/vacation_metadata"
      }
    }
  },
  "$defs": {
    "shift": {
      "type": "string",
      "minLength": 1
    },
    "date_full": {
      "type": "string",
      "pattern": "^(0[1-9]|[12][0-9]|3[01])-(0[1-9]|1[0-2])-\\d{4}$"
    },
    "weekday": {
      "type": "string",
      "enum": [
        "monday",
        "tuesday",
        "wednesday",
        "thursday",
        "friday",
        "saturday",
        "sunday"
      ]
    },
    "agent": {
      "type": "object",
      "additionalProperties": false,
      "required": [
        "name",
        "preferences",
        "restriction",
        "unavailable",
        "training",
        "exclusion",
        "vacations"
      ],
      "properties": {
        "name": {
          "type": "string",
          "minLength": 1
        },
        "include_in_balance": {
          "type": "boolean"
        },
        "preferences": {
          "type": "object",
          "additionalProperties": false,
          "required": [
            "preferred",
            "avoid"
          ],
          "properties": {
            "preferred": {
              "type": "array",
              "uniqueItems": true,
              "items": {
                "$ref": "#/$defs/shift"
              }
            },
            "avoid": {
              "type": "array",
              "uniqueItems": true,
              "items": {
                "$ref": "#/$defs/shift"
              }
            },
            "avoid_weekdays": {
              "type": "array",
              "uniqueItems": true,
              "items": {
                "$ref": "#/$defs/weekday"
              }
            },
            "coworkers": {
              "type": "object",
              "additionalProperties": {
                "type": "integer",
                "minimum": -2,
                "maximum": 2
              }
            }
          }
        },
        "restriction": {
          "type": "array",
          "uniqueItems": true,
          "items": {
            "$ref": "#/$defs/shift"
          }
        },
        "unavailable": {
          "type": "array",
          "uniqueItems": true,
          "items": {
            "$ref": "#/$defs/date_full"
          }
        },
        "training": {
          "type": "array",
          "uniqueItems": true,
          "items": {
            "$ref": "#/$defs/date_full"
          }
        },
        "exclusion": {
          "type": "array",
          "uniqueItems": true,
          "items": {
            "$ref": "#/$defs/date_full"
          }
        },
        "vacations": {
          "type": "array",
          "items": {
            "type": "object",
            "additionalProperties": false,
            "required": [
              "start",
              "end"
            ],
            "properties": {
              "start": {
                "$ref": "#/$defs/date_full"
              },
              "end": {
                "$ref": "#/$defs/date_full"
              }
            }
          }
        }
      }
    },
    "vacation_metadata": {
      "type": "object",
      "additionalProperties": false,
      "properties": {
        "label": {
          "type": "string",
          "minLength": 1
        },
        "is_night": {
          "type": "boolean"
        },
        "requires_next_day_rest": {
          "type": "boolean"
        },
        "start_time": {
          "$ref": "#/$defs/time_of_day"
        },
        "end_time": {
          "$ref": "#/$defs/time_of_day"
        }
      }
    },
    "half_vacation": {
      "type": "object",
      "additionalProperties": false,
      "required": [
        "enabled",
        "penalty",
        "segments"
      ],
      "properties": {
        "enabled": {
          "type": "boolean"
        },
        "penalty": {
          "type": "integer",
          "minimum": 0
        },
        "segments": {
          "type": "array",
          "minItems": 2,
          "items": {
            "$ref": "#/$defs/half_vacation_segment"
          }
        }
      }
    },
    "half_vacation_segment": {
      "type": "object",
      "additionalProperties": false,
      "required": [
        "name",
        "duration"
      ],
      "properties": {
        "name": {
          "$ref": "#/$defs/shift"
        },
        "label": {
          "type": "string",
          "minLength": 1
        },
        "duration": {
          "type": "number",
          "exclusiveMinimum": 0
        },
        "is_night": {
          "type": "boolean"
        },
        "requires_next_day_rest": {
          "type": "boolean"
        },
        "start_time": {
          "$ref": "#/$defs/time_of_day"
        },
        "end_time": {
          "$ref": "#/$defs/time_of_day"
        }
      }
    },
    "time_of_day": {
      "type": "string",
      "pattern": "^([01][0-9]|2[0-3]):[0-5][0-9]$"
    }
  }
}
