{
  "agents": [
    {
      "name": "Agent1",
      "include_in_balance": true,
      "preferences": {
        "preferred": [
          "Jour",
          "CDP"
        ],
        "avoid": [
          "Nuit"
        ],
        "avoid_weekdays": [],
        "coworkers": {
          "Agent2": -1,
          "Agent3": 2
        }
      },
      "restriction": [],
      "unavailable": [
        "15-01-2026"
      ],
      "training": [
        "20-01-2026"
      ],
      "exclusion": [],
      "vacations": [
        {
          "start": "02-03-2026",
          "end": "08-03-2026"
        }
      ]
    },
    {
      "name": "Agent2",
      "preferences": {
        "preferred": [
          "Nuit"
        ],
        "avoid": [
          "Jour",
          "CDP"
        ],
        "avoid_weekdays": [],
        "coworkers": {}
      },
      "restriction": [
        "Jour"
      ],
      "unavailable": [],
      "training": [],
      "exclusion": [
        "01-01-2026"
      ],
      "vacations": []
    },
    {
      "name": "Agent3",
      "preferences": {
        "preferred": [
          "Jour",
          "CDP"
        ],
        "avoid": [],
        "avoid_weekdays": [],
        "coworkers": {
          "Agent1": 2
        }
      },
      "restriction": [],
      "unavailable": [],
      "training": [],
      "exclusion": [],
      "vacations": [
        {
          "start": "10-08-2026",
          "end": "23-08-2026"
        }
      ]
    }
  ],
  "vacations": [
    "Jour",
    "Nuit",
    "CDP"
  ],
  "staffing_requirements": {
    "Jour": 1,
    "Nuit": 1,
    "CDP": 1
  },
  "vacation_durations": {
    "Jour": 12,
    "Nuit": 12,
    "CDP": 5.5,
    "Conge": 7
  },
  "holidays": [
    "01-01",
    "06-04",
    "01-05",
    "08-05",
    "14-07",
    "15-08",
    "01-11",
    "11-11",
    "25-12"
  ],
  "restriction_types_durations": {
    "HorsSite": 10.5,
    "VM": 2
  },
  "solver": {
    "max_time_seconds": 600,
    "relative_gap_limit": 0.1,
    "num_search_workers": 0,
    "global_max_gap": 240,
    "period_max_gap": 240,
    "max_weekly_hours": 36,
    "optimize_period_balance": false,
    "period_balance_weight": 2,
    "min_free_weekends_per_horizon": 3,
    "weekend_monday_night_penalty": 500,
    "coworker_preference_weight": 50
  },
  "half_vacations": {
    "Jour": {
      "enabled": true,
      "penalty": 500,
      "segments": [
        {
          "name": "Jour matin",
          "label": "J matin",
          "duration": 6
        },
        {
          "name": "Jour après-midi",
          "label": "J aprem",
          "duration": 6
        }
      ]
    },
    "Nuit": {
      "enabled": true,
      "penalty": 700,
      "segments": [
        {
          "name": "Nuit début",
          "label": "N début",
          "duration": 6,
          "is_night": true,
          "requires_next_day_rest": true
        },
        {
          "name": "Nuit fin",
          "label": "N fin",
          "duration": 6,
          "is_night": true,
          "requires_next_day_rest": true
        }
      ]
    }
  },
  "vacation_metadata": {
    "Jour": {
      "is_night": false,
      "start_time": "07:00",
      "end_time": "19:00"
    },
    "Nuit": {
      "is_night": true,
      "requires_next_day_rest": true,
      "start_time": "19:00",
      "end_time": "07:00"
    }
  },
  "vacation_colors": {
    "Jour": "#75FA79",
    "Jour matin": "#B9F6CA",
    "Jour après-midi": "#00C853",
    "Nuit": "#9175FA",
    "Nuit début": "#B39DDB",
    "Nuit fin": "#673AB7",
    "CDP": "#FFD966"
  }
}
