{
  "agents": [
    {
      "name": "Agent1",
      "preferences": {
        "preferred": ["Jour", "CDP"],
        "avoid": ["Nuit"]
        },
      "restriction": [],
      "unavailable": [],
      "training": [],
      "exclusion": [],
      "vacations": [
        { "start": "06-01-2025", "end": "12-01-2025" },
        { "start": "19-05-2025", "end": "25-05-2025" }
      ]
      },
    {
      "name": "Agent2",
      "preferences": {
        "preferred": ["Nuit"],
        "avoid": ["Jour", "CDP"]
        },
      "restriction": ["Jour"],
      "unavailable": [],
      "training": [],
      "exclusion": ["01-01-2025"],
      "vacations": [
        { "start": "10-03-2025", "end": "23-03-2025" }
      ]
      },
    {
      "name": "Agent3",
      "preferences": {
        "preferred": ["Nuit"],
        "avoid": []
        },
      "restriction": [],
      "unavailable": ["21-01-2025"],
      "training": [],
      "exclusion": [],
      "vacations": [
        { "start": "21-04-2025", "end": "27-04-2025" },
        { "start": "12-05-2025", "end": "18-05-2025" }
      ]
      },
    {
      "name": "Agent4",
      "preferences": {
        "preferred": ["Jour", "CDP"],
        "avoid": ["Nuit"]
        },
      "restriction": [],
      "unavailable": ["08-02-2025", "09-02-2025"],
      "training": [],
      "exclusion": ["01-01-2025", "11-01-2025", "12-01-2025"],
      "vacations": [
        { "start": "05-05-2025", "end": "11-05-2025" },
        { "start": "26-05-2025", "end": "31-05-2025" }
      ]
      },
    {
      "name": "Agent5",
      "preferences": {
        "preferred": ["Jour", "CDP"],
        "avoid": ["Nuit"]
        },
      "restriction": ["Nuit"],
      "unavailable": ["08-03-2025", "12-03-2025", "07-04-2025"],
      "training": [],
      "exclusion": [],
      "vacations": [
        { "start": "14-04-2025", "end": "20-04-2025" }
      ]
      },
    {
      "name": "Agent6",
      "preferences": {
        "preferred": ["Nuit"],
        "avoid": []
        },
      "restriction": [],
      "unavailable": [],
      "training": [],
      "exclusion": [],
      "vacations": [
        { "start": "24-02-2025", "end": "09-03-2025" }
      ]
      }
  ],
  "vacations": ["Jour", "Nuit", "CDP"],
  "vacation_durations": {
    "Jour": 12,
    "Nuit": 12,
    "CDP": 5.5,
    "Conge": 7
  },
  "holidays": [
    "01-01",
    "06-04",
    "01-05",
    "08-05",
    "14-05",
    "25-05",
    "14-07",
    "15-08",
    "01-11",
    "11-11",
    "25-12"
  ],
  "solver": {
    "max_time_seconds": 600,
    "relative_gap_limit": 0.1,
    "num_search_workers": 0,
    "global_max_gap": 240,
    "period_max_gap": 240,
    "optimize_period_balance": false,
    "period_balance_weight": 2
  }
}
